{"abi":{"endianness":"little","kernel":"6.1","libc":"glibc-2.39"},"architecture":"amd64","debian_snapshot":"debian-2026-08-01","environment":{"allowlist":["LANG","PATH"],"assignments":{"LANG":"C.UTF-8","PATH":"/usr/bin"}},"executables":[{"path":"usr/bin/cc","sha256":"0000000000000000000000000000000000000000000000000000000000000091"}],"id":"toolchain.profile","libraries":[{"sha256":"0000000000000000000000000000000000000000000000000000000000000092","soname":"libc.so.6"}],"packages":[{"name":"gcc","sha256":"0000000000000000000000000000000000000000000000000000000000000093","version":"14.2"}],"python":{"executable_sha256":"0000000000000000000000000000000000000000000000000000000000000094","implementation":"CPython","prefix":"opt/python","version":"3.12.8"},"schema":"kilix.content.toolchain-profile/v1","uv":{"executable_sha256":"0000000000000000000000000000000000000000000000000000000000000095","lock_sha256":"0000000000000000000000000000000000000000000000000000000000000096","offline":true,"version":"0.8.14"}}
